title,location,time,photoUrl,type
"Talks about Culture","Durga Maata Mandir, Chandrapur road, Mul","Sep 01, 4:00pm","https://i.imgur.com/j1ntzi0.png","past"
"Painting (Activity + Snacks)","Durga Maata Mandir, Chandrapur road, Mul","Sep 02, 9:00am","https://i.imgur.com/I7RRQuU.jpeg","past"
"Yoga (Activity + Snacks)","Durga Maata Mandir, Chandrapur road, Mul","Sep 03, 9:00am","https://i.imgur.com/5jrAAQ0.png","past"
"Drawing Workshop for Kids","Durga Maata Mandir, Chandrapur road, Mul","Jun 11, 6:30pm","https://i.imgur.com/CZWrkac.jpeg","past"
"Temple Cleanliness Campaign","Swami Samarth Mandir, Mul","Dec 15, 9:00am","https://i.imgur.com/1oLYpEi.jpeg","past"
"Yoga","Dec 14, 2:00pm","Durga Mandir, Mul","","past"
"Meditation","Dec 15, 2:00pm","Durga Mandir, Mul","https://i.imgur.com/tNeYnmK.jpeg","past"
"Environmental Awareness Discussion","Dec 16, 2:00pm","Durga Mandir, Mul","","past"
