Name,Town,Position,Phone Number,Description,Photo
Megha Jangada,Mul,Adhyaksh (President),9175768400,"Megha Jangada is the founder of the Vasant Shobha Foundation. Holding an MS in Computer Science and Education, her work has been profoundly shaped by her parents, a teacher (Mrs. Shobha Chaware) and a doctor (Mr. Vasantrao Chaware), who devoted their lives to community service in health and education. Motivated by their example, Megha established the Vasant Shobha Foundation with the goal of impacting communities positively. Her teaching career started in 1995 with computer workshops in Mul, and she currently teaches yoga for adults and Baal-Sanskar Varga classes for children. Her mission focuses on raising awareness and providing quality education and holistic development opportunities in India.",https://i.imgur.com/xmmPeNa.png
Smita Shinde,Chandrapur,Treasurer,9764432494,"Smita Shinde is an accomplished educator and dedicated community member with over 15 years of teaching experience. She holds a Master’s degree in History and a Postgraduate Diploma in Computer Applications (PGDCCA) and, in her professional capacity, serves as the Treasurer of this foundation. In addition to her professional roles, Smita is deeply committed to cultural education. She actively contributes to the Bal Sanskar Varga, where she teaches traditional values and shlokas, fostering cultural awareness and spiritual growth among young learners. Her extensive experience in education and her dedication to nurturing cultural heritage highlight her passion for both teaching and community service.",https://i.imgur.com/V3Z2OZF.png
Rajesh Sawarkar,Mul,Secretary,9403576075,"Rajesh V. Sawarkar is a dedicated educator and community leader currently serving as the Head Master of Deonil Vidyalaya in Tekadi, Mul Taluka, Chandrapur district. With a Bachelor of Science degree, a Bachelor of Education, and a postgraduate degree in Sociology, Mr. Sawarkar brings a wealth of knowledge and experience to his role in shaping young minds. Beyond his professional duties, Mr. Sawarkar is deeply involved in community service. As one of the founding members of Pragati Teacher Prathasanstha, he has played a pivotal role in advancing the interests of educators in the region. His ongoing dedication to education and community development continues to inspire and impact the lives of many in his community and beyond.",https://i.imgur.com/Th6pL2v.jpeg
Shreya Jangada,USA,Technology Lead,7328094830,"As a second-year Computer Science student, Shreya Jangada is deeply committed to leveraging technology for community benefit, especially in the fields of education and the environment. Her passion for making a positive impact has driven her to create this website and actively contribute to the technological and overall advancements of the organization. By utilizing digital tools, Shreya aims to improve outreach and effectiveness, ensuring that the organization can better serve and support those in need.",https://media.licdn.com/dms/image/D4E03AQHkbcS4FqCOqQ/profile-displayphoto-shrink_200_200/0/1713836703758?e=2147483647&v=beta&t=pLzGlnGtd4BFFp9LMKxDq31fzeRH6_lUNj52ylaUPjo
Vibha Samarth,Mul,Member,7775884164,"Vibha Samarth is a dedicated educator and passionate advocate for quality education within the foundation. Holding a Bachelor of Commerce and a Bachelor of Education, Vibha brings a unique perspective that blends financial literacy with pedagogical expertise to her volunteer work. As a key member of the foundation, Vibha plays a vital role in teaching various classes and supporting foundation events. Her commitment to the foundation's mission is evident in her tireless efforts to create engaging learning experiences and foster a sense of community among participants. Through her multifaceted contributions, Vibha Samarth embodies the foundation's commitment to holistic education and community development.",https://i.imgur.com/Iwh1Vbx.jpeg
Rashmi Adkine,Mul,Member,8390671165,"Rashmi Adkine, with a background in Arts and Fashion Designing, brings a decade of experience to our foundation. As the Head of the Bal Sanskar Varga in Mul, Rashmi is dedicated to nurturing values and sharing the profound wisdom of ancient Indian shlokas with children. Her role within the foundation is pivotal, ensuring that our mission to disseminate knowledge and promote quality education is achieved effectively and sustainably. Rashmi’s commitment and expertise play a crucial role in advancing our vision and impact.",https://i.imgur.com/0nPchyF.jpeg
Shobha Chaware,Mul,Member,9404124609,"Mrs. Shobha Chaware has dedicated 37 years to teaching in Mul, specializing in science education at the elementary school level and organizing fairs for the entire school. Shobha's career in teaching began in her hometown of Jamni, which lacked a school and educator. Her commitment extends beyond the classroom, as she has actively worked to improve literacy in her town by teaching other community members and has even taught Marathi to children in America during visits.",https://i.imgur.com/4oUarys.png